{
  "$schema": "http://json-schema.org/draft-07/schema#",
  "$id": "strategy.json",
  "title": "Strategy",
  "description": "A Yearn strategy",
  "type": "object",
  "properties": {
    "comment": {
      "type": "string"
    },
    "name": {
      "type": "string"
    },
    "description": {
      "type": "string"
    },
    "localization": {
      "type": "object",
      "properties": {
        "en": {
          "type": "object",
          "required": ["name", "description"],
          "properties": {
            "name": { "type": "string" },
            "description": { "type": "string" }
          }
        },
        "fr": {
          "type": "object",
          "required": ["name", "description"],
          "properties": {
            "name": { "type": "string" },
            "description": { "type": "string" }
          }
        },
        "es": {
          "type": "object",
          "required": ["name", "description"],
          "properties": {
            "name": { "type": "string" },
            "description": { "type": "string" }
          }
        },
        "de": {
          "type": "object",
          "required": ["name", "description"],
          "properties": {
            "name": { "type": "string" },
            "description": { "type": "string" }
          }
        },
        "pt": {
          "type": "object",
          "required": ["name", "description"],
          "properties": {
            "name": { "type": "string" },
            "description": { "type": "string" }
          }
        },
        "el": {
          "type": "object",
          "required": ["name", "description"],
          "properties": {
            "name": { "type": "string" },
            "description": { "type": "string" }
          }
        },
        "tr": {
          "type": "object",
          "required": ["name", "description"],
          "properties": {
            "name": { "type": "string" },
            "description": { "type": "string" }
          }
        },
        "vi": {
          "type": "object",
          "required": ["name", "description"],
          "properties": {
            "name": { "type": "string" },
            "description": { "type": "string" }
          }
        },
        "zh": {
          "type": "object",
          "required": ["name", "description"],
          "properties": {
            "name": { "type": "string" },
            "description": { "type": "string" }
          }
        },
        "hi": {
          "type": "object",
          "required": ["name", "description"],
          "properties": {
            "name": { "type": "string" },
            "description": { "type": "string" }
          }
        },
        "ja": {
          "type": "object",
          "required": ["name", "description"],
          "properties": {
            "name": { "type": "string" },
            "description": { "type": "string" }
          }
        },
        "id": {
          "type": "object",
          "required": ["name", "description"],
          "properties": {
            "name": { "type": "string" },
            "description": { "type": "string" }
          }
        },
        "ru": {
          "type": "object",
          "required": ["name", "description"],
          "properties": {
            "name": { "type": "string" },
            "description": { "type": "string" }
          }
        }
      },
      "required": [
        "en",
        "fr",
        "es",
        "de",
        "pt",
        "el",
        "tr",
        "vi",
        "zh",
        "hi",
        "ja",
        "id",
        "ru"
      ]
    },
    "authors": {
      "type": "array",
      "items": {
        "type": "object",
        "properties": {
          "name": {
            "type": "string"
          },
          "uri": {
            "type": "string",
            "format": "uri"
          }
        },
        "required": ["name"]
      }
    },
    "addresses": {
      "type": "array",
      "items": {
        "type": "string",
        "format": "address"
      }
    },
    "media": {
      "type": "string",
      "format": "uri"
    }
  },
  "required": ["name", "description", "addresses"]
}
