{
  "$schema": "strategy",
  "name": "CurvesaCRVVoterProxy",
  "description": "This vault accepts deposits of [saCRV](https://etherscan.io/address/0x02d341CcB60fAaf662bC0554d13778015d1b285C) tokens obtained by supplying either DAI or sUSD to the liquidity pool on Curve [here](https://www.curve.fi/saave/deposit). saCRV tokens are staked in the gauge on Curve to earn CRV rewards. Rewards are swapped for one of the underlying assets and resupplied to the liquidity pool to obtain more saCRV.",
  "addresses": ["0xE73817de3418bB44A4FeCeBa53Aa835333C550e7"],
  "authors": []
}