{
  "$schema": "strategy",
  "name": "ConvexcDAI+cUSDC",
  "description": "Supplies cDAI+cUSDC to Convex Finance to earn CRV and CVX. Rewards are harvested, sold for more cDAI+cUSDC, and deposited back into the vault.",
  "addresses": ["0x2b0b941d98848d6c9C729d944E3B1BD9C00A5529"],
  "authors": []
}
