{
    "$schema": "strategy",
    "name": "Rook Reward Strategy",
    "description": "Supplies {{token}} to [KeeperDAO](https://app.keeperdao.com/) to farm ROOK. Rewards are harvested, sold for more {{token}}, and deposited back into the vault.",
    "addresses": [
        "0x2B1a6CB0168aA540ee8D853aB1d10d7A89d6351b",
        "0xB361a3E75Bc2Ae6c8A045b3A43E2B0c9aD890d48",
        "0xbC0F2FF495eE2eb74A145EDAA457FA4Fa310DAC5"
    ],
    "authors": []
  }